{
  "event_id": "evt_fixture_inv_accepted_001",
  "event_type": "invitation.accepted",
  "event_version": 1,
  "occurred_at": "2026-08-04T12:00:00.000Z",
  "recorded_at": "2026-08-04T12:00:01.000Z",
  "producer": "opal_core_fixture",
  "aggregate_type": "relationship_invitation",
  "aggregate_id": "inv_fixture_001",
  "sequence": 2,
  "correlation_id": "corr_fixture_001",
  "causation_id": "evt_fixture_previous",
  "tenant_scope": "opal",
  "relationship_scope": "rel_fixture_001",
  "privacy_class": "restricted",
  "purpose": "relationship_onboarding",
  "trace_context": {},
  "topic_family": "opal.invitation.events",
  "partition_key": "inv_fixture_001",
  "payload": {
    "invitation_id": "inv_fixture_001",
    "relationship_id": "rel_fixture_001",
    "conversation_id": "conv_fixture_001"
  }
}
